<!--
FILE : ModelUnit.dtd

CREATED : 2018

LAST MODIFIED : 2020

AUTHOR : Agricultural Models Exchange Initiative

DESCRIPTION : This document contains a DTD corresponding to the syntax rules
  defined in the Crop2ML model unit's Specification for Crop2ML 1.1. This
  specification is available at
    https://raw.githubusercontent.com/AgriculturalModelExchangeInitiative/crop2ml/master/ModelUnit.dtd

COPYRIGHT : (2018).
-->

<!ELEMENT ModelUnit (Description,Inputs?,Outputs?,Initialization?,Function*, Algorithm+,Parametersets,Testsets)>
<!ATTLIST ModelUnit
  name CDATA #REQUIRED
  modelid CDATA #REQUIRED
  timestep CDATA #IMPLIED
  version CDATA #REQUIRED>

<!ELEMENT Description (Title,Authors,Institution,URI?,Reference?,ExtendedDescription, ShortDescription?)>
<!ATTLIST Description>

<!ELEMENT Inputs (Input)+>
<!ATTLIST Inputs>

<!ELEMENT Outputs (Output*)>
<!ATTLIST Outputs>

<!ELEMENT Algorithm (#PCDATA)>
<!ATTLIST Algorithm
  language CDATA #REQUIRED
  platform CDATA #IMPLIED
  filename CDATA #IMPLIED
  function CDATA #IMPLIED>

<!ELEMENT Parametersets (Parameterset*)>
<!ATTLIST Parametersets>

<!ELEMENT Testsets (Testset*)>
<!ATTLIST Testsets>

<!ELEMENT Function (#PCDATA)>
<!ATTLIST Function
	name CDATA #REQUIRED
	language CDATA #REQUIRED
	filename CDATA #IMPLIED
	type (internal|external) #REQUIRED
	description CDATA #IMPLIED>

<!ELEMENT Initialization (#PCDATA)>
<!ATTLIST Initialization
	name CDATA #REQUIRED
	language CDATA #REQUIRED
	filename CDATA #IMPLIED>	

<!ELEMENT Title (#PCDATA)>
<!ATTLIST Title>

<!ELEMENT Authors (#PCDATA)>
<!ATTLIST Authors>

<!ELEMENT Institution (#PCDATA)>
<!ATTLIST Institution>

<!ELEMENT URI (#PCDATA)>
<!ATTLIST URI>

<!ELEMENT Reference (#PCDATA)>
<!ATTLIST Reference>

<!ELEMENT ExtendedDescription (#PCDATA)>
<!ATTLIST ExtendedDescription>

<!ELEMENT ShortDescription (#PCDATA)>
<!ATTLIST ShortDescription>

<!ELEMENT Input EMPTY>
<!ATTLIST Input
  name NMTOKEN #REQUIRED
  datatype (CHAR|STRING|INT|DOUBLE|BOOLEAN|DATE|CHARARRAY|STRINGARRAY|INTARRAY|DOUBLEARRAY|BOOLEANARRAY|DATEARRAY|CHARLIST|STRINGLIST|INTLIST|DOUBLELIST|BOOLEANLIST|DATELIST) #REQUIRED 
  description CDATA #REQUIRED
  default CDATA #IMPLIED
  len CDATA #IMPLIED
  max CDATA #IMPLIED
  min CDATA #IMPLIED
  inputtype (variable|parameter) #REQUIRED
  parametercategory (constant|species|genotypic|soil|private) #IMPLIED
  variablecategory (state|rate|auxiliary|exogenous) #IMPLIED
  unit CDATA #REQUIRED
  uri CDATA #IMPLIED>

<!ELEMENT Output EMPTY>
<!ATTLIST Output
  name NMTOKEN #REQUIRED
  datatype (CHAR|STRING|INT|DOUBLE|BOOLEAN|DATE|CHARARRAY|STRINGARRAY|INTARRAY|DOUBLEARRAY|BOOLEANARRAY|DATEARRAY|CHARLIST|STRINGLIST|INTLIST|DOUBLELIST|BOOLEANLIST|DATELIST) #REQUIRED 
  description CDATA #REQUIRED
  len CDATA #IMPLIED
  max CDATA #IMPLIED
  min CDATA #IMPLIED
  variablecategory (state|rate|auxiliary|exogenous) #IMPLIED
  unit CDATA #REQUIRED
  uri CDATA #IMPLIED>

<!ELEMENT Parameterset (Param*)>
<!ATTLIST Parameterset
  description CDATA #REQUIRED
  name NMTOKEN #REQUIRED
  uri CDATA #IMPLIED>

<!ELEMENT Testset (Test*)>
<!ATTLIST Testset
  description CDATA #REQUIRED
  name CDATA #REQUIRED
  parameterset NMTOKEN #REQUIRED
  uri CDATA #IMPLIED>

<!ELEMENT Test (InputValue*, OutputValue+)>
<!ATTLIST Test
  description CDATA #IMPLIED
  name CDATA #REQUIRED
  uri CDATA #IMPLIED>

<!ELEMENT Param (#PCDATA) >
<!ATTLIST Param name CDATA #REQUIRED >

<!ELEMENT InputValue (#PCDATA) >
<!ATTLIST InputValue name CDATA #REQUIRED >

<!ELEMENT OutputValue (#PCDATA) >
<!ATTLIST OutputValue name CDATA #REQUIRED >
<!ATTLIST OutputValue description CDATA #IMPLIED >
<!ATTLIST OutputValue precision CDATA #IMPLIED >
